{
  "schemaVersion": 1,
  "reportId": "84e8eeda-e823-4ab5-9127-0ce449a0b689",
  "generatedAt": "2026-10-18T10:40:23.245Z",
  "mode": "fixture",
  "overall": "pass",
  "execution": {
    "status": "completed",
    "failure": null
  },
  "methodology": "deterministic_application_assertions_independent_sandbox_evidence",
  "source": {
    "commit": "dbac8b07248ccea48e306e9fc6dec8aa3593f309",
    "dirty": false,
    "files": {
      ".github/workflows/spike.yml": "37098c7558022904988eaa501b67cccb09dfb50ebc2a8b66ef391068ce8e600a",
      "agent/agent.ts": "a3cc2f4b28153b8610c4c64934f124efd6a55bf3ffb626a81a5df50ee3615e87",
      "agent/channels/eve.ts": "72f674ea6d5938f324a6854495b339c380af49762b8a9787e0f83a0a6328207b",
      "agent/channels/lab.ts": "90cd4c9d99066b24616ce8167424bb8277637a7aeed30872a68cf48442346338",
      "agent/channels/operator.ts": "f1c7d2e76f730042c417f72e21f1c6ecfe3a172986b20f89624f46b2b28695e2",
      "agent/instructions.md": "9caf2fe4552f518b40812f03cc3ee0544a18e354a3547d595f679e98fb4dde1c",
      "agent/lib/lab/contracts.ts": "62b065836a6e933327339586a454e1596798e7e36292b6b1c7f9e08d4c87dfe0",
      "agent/lib/lab/execution.ts": "d153c9a783a2c97d4853d4cca106010d9040a002b90e35b867e5abf5a72f4584",
      "agent/lib/lab/fixture-model.ts": "36663a9f138c1844b746ce5ff979cf18432780351f2501b8193bfd1653776311",
      "agent/lib/lab/limits.ts": "45c9808e3db7780e0dde8e27c0c617a25a8d0e9cfeff7549fe8a2cbac2bdda4b",
      "agent/lib/lab/namespaces.ts": "b08f86ff51c6e1e0ebe6e3c5b8113484f279c0da18a5c4bb3a9072d99425c54f",
      "agent/lib/lab/operator-ui.ts": "f3f4e8089540b284fa9e89dfa421770d48fd61938f127007e10dec12f3200498",
      "agent/lib/lab/runtime.ts": "2441e34f2f42f550c1be5ff3d9c545cb3030789c36ab0c7d56274fef198a3e0c",
      "agent/lib/lab/store.ts": "3d3a9133ff083ff8f6b2a6a4c0f5d6ed715f11af48fa905454e20135493a6168",
      "agent/lib/lab/workflow.ts": "4c8b2a6040dae2404ec7212d74ff9ce0d73a92ccbe9fb928e708f6a69ad8ba53",
      "agent/lib/scripted-model.ts": "45847f4008b3f5ee9366a4728c7dabaf4f13c6b7e6492660f4d961ec93222b25",
      "agent/tools/delivery.ts": "f45028fa1cc4d9e9ceaea5aaacc522c2496925dc58bf31ed03dd6cccacbf4b01",
      "agent/tools/probe.ts": "0bf801c44ee56697fe88ba022b4ca9c7107beec5d08db82b41b515d7488c897e",
      "evaluation/reporting.ts": "6eddff5caf0b7c321af56321dec10f56f33aef1ad3fd846de51db36d01873743",
      "evaluation/schema.mjs": "f8c90db1c846cc83dcb6f978c9602737b1f1069e596559fcfbdc06267851dc6b",
      "evaluation/schemas/report.schema.json": "aca49eccd7c2d12e56fa60f63ea15f01933f6b791d27a38757937f0561feb661",
      "evaluation/schemas/report.ts": "ae4bb515aafbd47ecf010a843e1391f565397ddf3c054d2ed7eb89ba30dd38ef",
      "evaluation/validate.mjs": "0ccbe66381adcc4096a69818c9634da82340d89439defb20bfe77664f7e26ff1",
      "fixtures/evaluation-catalog.json": "ee8c412adefed72f02e25da5264e56442a716fe309130c5218be08ac95e92caf",
      "lab/cli.mjs": "829e45ef7d9a5f04cadec1aafcfabaa66a25b9a507a1fb109f85a185209a4c0d",
      "lab/worker-entry.mjs": "b5cccc1e02aa320ee34e289dc5e471c24ff452a10fd64ae74dda48dc56ce4a95",
      "package-lock.json": "4e76b468c6ab8276f2e275a0d78d92c22f2a65ad0e904442c89898d01fb75364",
      "package.json": "cbcf23f23e7eb563219572819ed28a91f05e214e4efed3fffd063217f4128307",
      "sandbox/server.ts": "d127d3d50679bdfea290e7581f9c19e83054d24a6d570ba32012dde8029c0233",
      "sandbox/service.ts": "88c474cf1cfe1503fbe53bd25d342706d02c4f7ac5076e00dcb915a1aff35f91",
      "spike/callback-proxy.mjs": "2599c57babcf4480b4c2575136c14c83acc7323b8c133546497c3b714f14657f",
      "spike/locked-start.py": "3ed28b3f299a293d984098eab7efba0f7a761dade12ade8c3cb0565f4fc47a9c",
      "spike/model.test.mjs": "b854e92f8cd9c60c509204688195ccc1c82f521a38493f95110832c4a77946f8",
      "spike/overlap.mjs": "033a4419593670eb2a2e98ef48673e812b68bd4d184af595d779b826edac4fd0",
      "spike/ownership.mjs": "0e9310ac25cf47cd786d5c18a6939edeacaeaa372c04e3c930bc9306e83c7dfc",
      "spike/run.mjs": "428de3d7b2b02e91f84b54c580bb4297a21e386b3924cfcd180f72588090e925",
      "spike/runtime-compatibility.mjs": "679d94f9fc4300df0d7608adcd06b3674b5cc4ee7243ad4a088749a32bdee034",
      "test/budgets.test.mjs": "5ce1ac5ab53b409d65ffbf281b7f5c15381f4a8d85a445b8861aa4039b3a71ab",
      "test/contracts.test.mjs": "bc0e823e881482dec65c7306dd0f5e6c39611f4df67a6fa06d1f0541d741d186",
      "test/evaluate.mjs": "61850a2eff10ef957db0e2cb75875f9e7702c1fed2ee77501fbae85cff54c194",
      "test/evaluation.mjs": "094f19df5158b5f53214523e3807f85869f1ea68ae7eeae174c77955b9f337dc",
      "test/fault-hooks.test.mjs": "997d6c943f493831abe1316c3fb2cef32f39afc16080039464399432b72ba6d3",
      "test/milestone3.mjs": "231569892253d680361a18165328fcefeb4354bea88a23e362f52491e6c697ed",
      "test/negative-controls.mjs": "548f1a5565481029c3574ca83cfcd3999bc30846c9a9344c4df865b1ec3c2b29",
      "test/negative-probe.mjs": "e8bf402276d2c27c80e03db6d1859193b9f39afa77978e9077d3a305134bc7a5",
      "test/operator.test.mjs": "e5556bff9cf3880c05417289c030dfcc56b030e0eb2f47f147721266b3aef34c",
      "test/report.test.mjs": "a008128d29025fa6a3960fdb58abce67d22195f3fee9699ab7f56391f7c8cd11",
      "test/sandbox.test.mjs": "77e94066b247bc00db26be2dcc6f2a5329bef987300bf534a2eb95e55dcfa8bf",
      "test/store.test.mjs": "10203d0699d71bf930d31b8518ea9773597d0bbabf348201620794aff15ab850",
      "test/workflow-fixture.mjs": "503d0875ba9ffc847a003d585d75167a6aaeacdf349794cb02223d05df6cb458",
      "test/workflow.mjs": "e7b1d251b6af089215fb67b4582b13478d45383008d72404655903ac6da9e636"
    },
    "dependencyHash": "4e76b468c6ab8276f2e275a0d78d92c22f2a65ad0e904442c89898d01fb75364",
    "configurationHash": "26fd037ebd3638d1d826c1a949a4729a61ed9232da668f5861935c2bbf5f4dc3",
    "fixtureHash": "deded017f06d11340e6276961dabe08b213ea6b67112f91acfde2418b0c92bec"
  },
  "environment": {
    "node": "v24.21.0",
    "platform": "linux",
    "namespaceVersion": "isolated-dataset-v1",
    "fixtureVersion": "synthetic-delivery-support-v1"
  },
  "runtime": {
    "framework": "eve",
    "version": "0.80.1",
    "guardHashes": {
      "dist/src/compiled/_chunks/workflow/helpers-DlLD3ov_.js": "747627feb4fc23f0bd998d2f4ca42969b6681380ded6d57fef3dd6fe5ca14903",
      "dist/src/compiled/@workflow/core/runtime.js": "4422b829266cd9daf01d5a9b861aa5dbccf3c1a0a3ab8398da85e60e74d5397e",
      "dist/src/compiled/@workflow/world-local/index.js": "2b049eae015887730a6b92a0fd00fd1cb099543859ed9f7490a377c1bae1a516"
    },
    "ownershipLeaseSeconds": 20,
    "ownership": "single_host_os_locked_worker"
  },
  "model": {
    "adapterVersion": "scripted-probe-v1",
    "adapterHash": "45847f4008b3f5ee9366a4728c7dabaf4f13c6b7e6492660f4d961ec93222b25",
    "provider": null,
    "providerVersion": null,
    "inputTokens": null,
    "outputTokens": null,
    "estimatedCost": null,
    "priceTableDate": null,
    "liveStatus": "not_run"
  },
  "cases": [
    {
      "id": "happy_path_duplicate_approval",
      "kind": "scenario",
      "mode": "fixture",
      "status": "pass",
      "sampleCount": 1,
      "expectedEffects": 1,
      "observedEffects": 1,
      "duplicateEffects": null,
      "taskSuccess": true,
      "policyViolations": null,
      "attempts": {
        "modelTurns": 3,
        "toolCalls": 3,
        "readAttempts": 2,
        "dispatchAttempts": null
      },
      "recoveryMs": null,
      "latencyMs": 1368,
      "barrierId": null,
      "negativeControl": null,
      "failureCode": null
    },
    {
      "id": "approval_persistence_response_gap_repaired",
      "kind": "scenario",
      "mode": "fixture",
      "status": "pass",
      "sampleCount": 1,
      "expectedEffects": 1,
      "observedEffects": 1,
      "duplicateEffects": null,
      "taskSuccess": true,
      "policyViolations": null,
      "attempts": {
        "modelTurns": 3,
        "toolCalls": 3,
        "readAttempts": 2,
        "dispatchAttempts": null
      },
      "recoveryMs": null,
      "latencyMs": 1206,
      "barrierId": null,
      "negativeControl": null,
      "failureCode": null
    },
    {
      "id": "reject_before_intent_zero_effect",
      "kind": "scenario",
      "mode": "fixture",
      "status": "pass",
      "sampleCount": 1,
      "expectedEffects": 0,
      "observedEffects": 0,
      "duplicateEffects": null,
      "taskSuccess": true,
      "policyViolations": null,
      "attempts": {
        "modelTurns": 3,
        "toolCalls": 2,
        "readAttempts": 2,
        "dispatchAttempts": null
      },
      "recoveryMs": null,
      "latencyMs": 1133,
      "barrierId": null,
      "negativeControl": null,
      "failureCode": null
    },
    {
      "id": "cancel_before_intent_zero_effect",
      "kind": "scenario",
      "mode": "fixture",
      "status": "pass",
      "sampleCount": 1,
      "expectedEffects": 0,
      "observedEffects": 0,
      "duplicateEffects": null,
      "taskSuccess": true,
      "policyViolations": null,
      "attempts": {
        "modelTurns": 3,
        "toolCalls": 2,
        "readAttempts": 2,
        "dispatchAttempts": null
      },
      "recoveryMs": null,
      "latencyMs": 1152,
      "barrierId": null,
      "negativeControl": null,
      "failureCode": null
    },
    {
      "id": "stale_context_after_proposal_zero_effect",
      "kind": "scenario",
      "mode": "fixture",
      "status": "pass",
      "sampleCount": 1,
      "expectedEffects": 0,
      "observedEffects": 0,
      "duplicateEffects": null,
      "taskSuccess": true,
      "policyViolations": null,
      "attempts": {
        "modelTurns": 3,
        "toolCalls": 3,
        "readAttempts": 2,
        "dispatchAttempts": null
      },
      "recoveryMs": null,
      "latencyMs": 1203,
      "barrierId": null,
      "negativeControl": null,
      "failureCode": null
    },
    {
      "id": "expired_at_commit_reapproval_same_key",
      "kind": "scenario",
      "mode": "fixture",
      "status": "pass",
      "sampleCount": 1,
      "expectedEffects": 1,